### ISSUE TITLE
tcpdump - create doc

### ISSUE THREAD

**Issue by raphaelsander** [raphaelsander/my-docs#5]
Iniciar captura:

```
tcpdump -v -i eth0 icmp -w icmp.pcap
```

Ler arquivo:

```
$ tcpdump -r icmp.pcap

reading from file icmp.pcap, link-type EN10MB (Ethernet), snapshot length 262144
19:54:49.865353 IP 172.31.82.161 > dns.google: ICMP echo request, id 1, seq 1, length 64
19:54:49.904551 IP dns.google > 172.31.82.161: ICMP echo reply, id 1, seq 1, length 64
```

Exibir IP ao invés do hostname:

```
$ tcpdump -n -r icmp.pcap

reading from file icmp.pcap, link-type EN10MB (Ethernet), snapshot length 262144
19:54:49.865353 IP 172.31.82.161 > 8.8.8.8: ICMP echo request, id 1, seq 1, length 64
19:54:49.904551 IP 8.8.8.8 > 172.31.82.161: ICMP echo reply, id 1, seq 1, length 64
```

Exibir informações do protocolo Ethernet:

```
$ tcpdump -n -e -r icmp.pcap

reading from file icmp.pcap, link-type EN10MB (Ethernet), snapshot length 262144
19:54:49.865353 00:15:5d:a1:da:41 > 00:15:5d:ba:33:a4, ethertype IPv4 (0x0800), length 98: 172.31.82.161 > 8.8.8.8: ICMP echo request, id 1, seq 1, length 64
19:54:49.904551 00:15:5d:ba:33:a4 > 00:15:5d:a1:da:41, ethertype IPv4 (0x0800), length 98: 8.8.8.8 > 172.31.82.161: ICMP echo reply, id 1, seq 1, length 64
```

**Comment by raphaelsander** [comment]
Commits:
 - 9f19b94649e04b56256d34c7e7ce9da4e6b921c8
